index;name;gender;age;profession;home_situation;fitness;symptoms;description;image
0;Nicolaas;Man;87;"Gepensioneerde; beroep was Apotheker";Weduwnaar;Laag;Mild;Ondanks zijn leeftijd van 87 heeft Nicolaas hard moeten werken de afgelopen maanden om alle zieken van medicijnen te voorzien. Sinds 3 jaar is hij weduwe en heeft hij zijn oude baan als apotheker weer opgepakt. Tijdens zijn bezoek aan mevrouw Janssen viel het Nicolaas op dat mevrouw last had van haar luchtwegen. Een aantal dagen later begon Nicolaas zelf te snotteren en besloot hij toch maar een Diabolo test te doen. Nog voor de uitslag binnen was had Nicolaas ernstig last van zijn luchtwegen en besloot een van zijn kinderen hem naar het ziekenhuis te brengen.;patients/guidelines_video/patient_1.jpg
1;Marielle;Vrouw;80;"Gepensioneerde; beroep was Rechercheur";Getrouwd;Hoog;Zeer hoog;Marielle is met haar 80 jaar nog steeds een bezig bijtje. Ze is haar hele leven al alleen wonend geweest en zoekt het sociale contact dus veelal buitenshuis. Sinds ze met pensioen is, doet Marielle tolk werk voor stichting vluchtelingen. Een van de vluchtelingenhuizen waar Marielle regelmatig komt is sinds een week dicht wegens een Diabolo uitbraak. Gisteren begon Marielle zelf ook erg te hoesten en toen ze vanochtend bijna geen lucht kreeg heeft ze de ambulance gebeld.;patients/guidelines_video/patient_2.jpg
2;Benny;Man;91;"Gepensioneerde; beroep was Kapper";Weduwnaar;Laag;Hoog;Benny is een echte familieman. Het viel hem dan ook enorm zwaar toen 2 maanden geleden zijn vrouw overleed aan een hersentumor. Zelf merkt Benny dat met zijn 91 ook voor hem de ouderdom zijn tol begint te eisen, en is steeds slechter ter been. Voor zijn pensioen is hij jarenlang kapper geweest en heeft daarbij lange dagen staand doorgebracht. Gisteren kreeg hij last van benauwdheid. Om het zekere voor het onzekere te nemen, besloot hij contact op te nemen met het ziekenhuis.;patients/guidelines_video/patient_3.jpg
3;Dominique;Vrouw;60;Postbode;Gescheiden;Hoog;Gemiddeld;Dominique is 60 jaar en postbode van beroep. Dominique heeft geen kinderen en is eerder dit jaar gescheiden van haar man. Anderhalve week geleden werd bij de moeder van Dominique diabolo ontdekt waaraan de oude vrouw een paar dagen later ook overleed. Op de begrafenis van haar moeder was Dominique veel aan het snotteren, wat ze aan haar verdriet toeschreef. Sinds 2 dagen is het snotteren erger geworden en is Dominique ook veel aan het hoesten en heeft ze moeite met ademen. Ze herkende de symptomen gelijk van haar moeder en is direct naar het ziekenhuis gekomen.;patients/guidelines_video/patient_4.jpg
4;Adriana;Vrouw;19;Student;Thuiswonend kind;Zeer laag;Mild;Adriana is net begonnen met haar nieuwe studie tot tandartsassistent. Ze is ontzettend blij dat ze kon studeren, want haar gezondheidsproblemen maakt dat ze vaak in het ziekenhuis te vinden is. Ondanks Diabolo had de studie een introductieperiode afgelopen augustus. Adriana heeft ontzettend haar best gedaan zo goed mogelijk afstand te houden, maar besloot om haar slechte gezondheid toch een test te doen na de introductie periode. Daaruit bleek ze positief getest.;patients/guidelines_video/patient_5.jpg
5;Benjamin;Man;34;Advocaat;Gescheiden;Laag;Hoog;Omschrijving komt hier;patients/guidelines_video/patient_6.jpg
6;Julliet;Vrouw;36;Glazenwasser;Getrouwd met 2 kind(eren);Laag;Hoog;Omschrijving komt hier;patients/guidelines_video/patient_7.jpg
